{
  "$schema": "../CARRIER/SCHEMAS/lineage-index.schema.json",
  "schema": "local-reality-body.lineage-index.v0.1",
  "body_id": "RM-LOCAL-REALITY-BODY-001",
  "represented_currentness_revision": 6,
  "authoritative_evidence_remains_in_exact_objects": true,
  "motion_chains": [
    {
      "motion_id": "RM-LOCAL-REALITY-BODY-FORMATION-MOTION-001",
      "classification": "PRECONSTITUTIONAL_FORMATION",
      "retrospectively_regulated": false,
      "candidate": {"carrier": "LINEAGE/CANDIDATES/FIRST_LOCAL_REALITY_BODY_CANDIDATE_001.md", "sha256": "f61959c964b768110708d7ca98b28f87b16ea1e496ffd926cfa177b9dff3310d"},
      "act": {"carrier": "LINEAGE/ACTS/FORMATION_ACT_001.md", "sha256": "67ba6d092d9343f9e62e94b0e332b1ff36cd08d1536cda7b6bea33869a2cb9d1"},
      "occurrence": {"carrier": "LINEAGE/OCCURRENCES/FORMATION_OCCURRENCE_001.md", "sha256": "eb419df3af209d1684c8935747b9e9f5f77c33babc978bfec6c49f84b9fb1da6"},
      "successor_state": {"carrier": "LINEAGE/STATE_REVISIONS/CURRENT_REVISION_000.json", "sha256": "2a7e7d51aea65ba37d89a46e9b0d78d737d3e4143b68609cb7171e3763ef58f7"},
      "result": "FORMED"
    },
    {
      "motion_id": "RM-BODY-INTEGRITY-HOST-ADMISSION-MOTION-001",
      "classification": "BODY_LOCAL_ADAPTATION",
      "retrospectively_regulated": false,
      "candidate": {"carrier": "LINEAGE/CANDIDATES/BODY_INTEGRITY_HOST_ADMISSION_CANDIDATE_001.md", "sha256": "3751edb1019a7164f1c563a7a3b95df30fd3b2be3e65de6770d7aaad4a8c68d4"},
      "act": {"carrier": "LINEAGE/ACTS/BODY_INTEGRITY_HOST_ADMISSION_ACT_001.md", "sha256": "5a4758374fedf23ce14a5cb35ce908c26fe0a55fd4e3c3a968ca76531c346b42"},
      "occurrence": {"carrier": "LINEAGE/OCCURRENCES/BODY_INTEGRITY_HOST_ADMISSION_OCCURRENCE_001.md", "sha256": "c61b3a710b2cc5be89443602bfa913855c28c0fae2a0ce7b1534a1348b74eaf9"},
      "successor_state": {"carrier": "LINEAGE/STATE_REVISIONS/CURRENT_REVISION_001.json", "sha256": "5e7c1f17430a626e5c49db8cfafc345882bd96c58800b2944747b526d4042356"},
      "result": "ADMITTED_INACTIVE"
    },
    {
      "motion_id": "RM-LOCAL-REALITY-BODY-CARRIER-TOPOLOGY-MOTION-001",
      "classification": "BODY_LOCAL_CORRECTION_AND_ADAPTATION",
      "retrospectively_regulated": false,
      "candidate": {"carrier": "LINEAGE/CANDIDATES/LOCAL_REALITY_BODY_CARRIER_TOPOLOGY_CANDIDATE_001.md", "sha256": "393e00f2292a793fdd64f22379c3d69d22a126f9b17a3db7c3562fa683d498da"},
      "act": {"carrier": "LINEAGE/ACTS/CARRIER_TOPOLOGY_ACT_001.md", "sha256": "947cde3815d1c08bee3d522cf90e907f475bd5a904a49c4657850d911b6d8662"},
      "occurrence": {"carrier": "LINEAGE/OCCURRENCES/CARRIER_TOPOLOGY_OCCURRENCE_001.md", "sha256": "5334a76d7d2a30a0b8c8da2f13a92a9408dca9f99929a3fcfcc618f2fe58abb9"},
      "successor_state": {"carrier": "LINEAGE/STATE_REVISIONS/CURRENT_REVISION_002.json", "sha256": "7cec0c9bc5f9c269d9e28176fe0fd569c270880beb6f66b98240618a2955a7ab"},
      "result": "CORRECTED_AND_ADAPTED"
    },
    {
      "motion_id": "RM-LOCAL-REALITY-BODY-REGULATED-MOTION-TOPOLOGY-MOTION-001",
      "classification": "BODY_LOCAL_CORRECTION_AND_ADAPTATION",
      "retrospectively_regulated": false,
      "candidate": {"carrier": "LINEAGE/CANDIDATES/LOCAL_REALITY_BODY_REGULATED_MOTION_TOPOLOGY_CANDIDATE_001.md", "sha256": "c197415d84c271f1bb05ba0b003c954b490a4c870697353103061906b0740564"},
      "act": {"carrier": "LINEAGE/ACTS/REGULATED_MOTION_TOPOLOGY_ACT_001.md", "sha256": "d070b1f4b0cf83f7e0f82359ecd61a7099f05096f4e3dd8ed3e5bb973167d2f8"},
      "occurrence": {
        "carrier": "LINEAGE/OCCURRENCES/REGULATED_MOTION_TOPOLOGY_OCCURRENCE_001.md",
        "binding": "CURRENT_STATE_CARRIES_OCCURRENCE_METADATA"
      },
      "successor_state": {
        "carrier": "CURRENT/STATE.json",
        "binding": "OCCURRENCE_CARRIES_FINAL_STATE_HASH"
      },
      "result": "CORRECTED_AND_ADAPTED"
    },
    {
      "motion_id": "RM-LOCAL-REALITY-BODY-FORM-EXPOSURE-MOTION-001",
      "classification": "BODY_LOCAL_GOVERNING_ADAPTATION_AND_OPERATIONAL_EXPOSURE",
      "retrospectively_regulated": false,
      "candidate": {
        "carrier": "LINEAGE/CANDIDATES/LOCAL_REALITY_BODY_FORM_EXPOSURE_CANDIDATE_001/CANDIDATE.md",
        "sha256": "b73a70e866def2f59df42a211d45b56cfbb52e2789f235f977fa74069d7ef63b"
      },
      "act": {
        "carrier": "LINEAGE/ACTS/BODY_FORM_EXPOSURE_ACT_001.md",
        "sha256": "b4bbc97415c6c8ab63f3ce454dd9fcbc8f712880def6d5eb9060b1a7e18a1e85"
      },
      "occurrence": {
        "carrier": "LINEAGE/OCCURRENCES/BODY_FORM_EXPOSURE_OCCURRENCE_001.md",
        "binding": "CURRENT_STATE_CARRIES_OCCURRENCE_METADATA"
      },
      "successor_state": {
        "carrier": "CURRENT/STATE.json",
        "binding": "OCCURRENCE_CARRIES_FINAL_STATE_HASH"
      },
      "result": "BODY_FORM_EXPOSED_LOCAL_ONLY"
    },
    {
      "motion_id": "RM-REALITY-CONTACT-MEMBRANE-ACTIVATION-MOTION-001",
      "classification": "BODY_LOCAL_ADAPTATION_AND_BOUNDED_OPERATIONAL_ACTIVATION",
      "retrospectively_regulated": false,
      "candidate": {
        "carrier": "LINEAGE/CANDIDATES/REALITY_CONTACT_MEMBRANE_ACTIVATION_CANDIDATE_001.md",
        "sha256": "e79d4640f08bf291fbf7d221215c6cef2ddfb476a91ba0f31b7734d542f96292"
      },
      "act": {
        "carrier": "LINEAGE/ACTS/REALITY_CONTACT_MEMBRANE_ACTIVATION_ACT_001.md",
        "sha256": "14fdd9ab64b689aa0813395e5436a46ce2bd51e33fa8708a739867b1cac5fff0"
      },
      "occurrence": {
        "carrier": "LINEAGE/OCCURRENCES/REALITY_CONTACT_MEMBRANE_ACTIVATION_OCCURRENCE_001.md",
        "binding": "CURRENT_STATE_CARRIES_OCCURRENCE_METADATA"
      },
      "successor_state": {
        "carrier": "CURRENT/STATE.json",
        "binding": "OCCURRENCE_CARRIES_FINAL_STATE_HASH"
      },
      "result": "MECHANISM_ADMITTED_AND_ACTIVATED_BOUNDED"
    },
    {
      "motion_id": "RM-REALITY-CONTACT-MEMBRANE-COHERENCE-CORRECTION-MOTION-001",
      "classification": "BODY_LOCAL_CORRECTION",
      "retrospectively_regulated": false,
      "candidate": {
        "carrier": "LINEAGE/CANDIDATES/REALITY_CONTACT_MEMBRANE_COHERENCE_CORRECTION_CANDIDATE_001.md",
        "sha256": "0ebab0ccaf19ae3168b3119f8966e9e2f2cb6ac8909c27fa43a43cf73e6875db"
      },
      "act": {
        "carrier": "LINEAGE/ACTS/REALITY_CONTACT_MEMBRANE_COHERENCE_CORRECTION_ACT_001.md",
        "sha256": "53e146347a13a9f9523b9534e768e7fb5a63545dbef7af0215a6f86eea45d576"
      },
      "occurrence": {
        "carrier": "LINEAGE/OCCURRENCES/REALITY_CONTACT_MEMBRANE_COHERENCE_CORRECTION_OCCURRENCE_001.md",
        "binding": "CURRENT_STATE_CARRIES_OCCURRENCE_METADATA"
      },
      "successor_state": {
        "carrier": "CURRENT/STATE.json",
        "binding": "OCCURRENCE_CARRIES_FINAL_STATE_HASH"
      },
      "result": "COHERENCE_CORRECTED_LIVING_STATE_PRESERVED"
    }
  ],
  "explicit_non_effects": [
    "NO_RETROSPECTIVE_REGULATION",
    "NO_MANDATORY_UNIVERSAL_WORKFLOW",
    "NO_REPLACEMENT_OF_EXACT_LINEAGE_EVIDENCE",
    "NO_OCCURRENCE_OR_CURRENTNESS_BY_INDEX_EXISTENCE",
    "NO_RECEIVER_FORMATION_RELATION_OR_CONTACT_BY_EXPOSURE_LINEAGE"
  ]
}
